Quarter,Time,Down,ToGo,Location,ATL,DEN,Detail,EPB,EPA
,,,,,,,Falcons won the coin toss and deferred Broncos to receive the opening kickoff.,,
1,15:00,,,ATL 35,0,0,Bradley Pinion kicks off 65 yards touchback.,0.000,0.940
1,15:00,1,10,DEN 30,0,0,Javonte Williams up the middle for 1 yard (tackle by Kaden Elliss),0.940,0.530
1,14:30,2,9,DEN 31,0,0,Bo Nix pass incomplete short middle intended for Javonte Williams,0.530,-0.160
1,14:25,3,9,DEN 31,0,0,Bo Nix pass complete short left to Courtland Sutton for 16 yards,-0.160,2.060
1,13:52,1,10,DEN 47,0,0,Javonte Williams left guard for 10 yards (tackle by Kevin King),2.060,2.720
1,13:13,1,10,ATL 43,0,0,Javonte Williams up the middle for 5 yards (tackle by Nathan Landman),2.720,2.850
1,12:37,2,5,ATL 38,0,0,Jaleel McLaughlin right end for no gain (tackle by Kevin King). Penalty on Lil'Jordan Humphrey: Offensive Holding 10 yards (accepted) (no play),2.850,1.500
1,12:17,2,15,ATL 48,0,0,Bo Nix pass complete short middle to Devaughn Vele for 14 yards (tackle by Clark Phillips),1.500,2.680
1,11:35,3,1,ATL 34,0,0,Michael Burton up the middle for 2 yards (tackle by Kentavius Street and Nathan Landman),2.680,3.450
1,10:56,1,10,ATL 32,0,0,Bo Nix pass complete short left to Devaughn Vele for 8 yards (tackle by Clark Phillips). Penalty on Richie Grant: Unnecessary Roughness / Defense 12 yards (accepted),3.450,4.780
1,10:36,1,10,ATL 12,0,6,Bo Nix pass complete short left to Nate Adkins for 12 yards touchdown,4.780,7.000
1,10:31,,,ATL 15,0,7,Wil Lutz kicks extra point good,0.000,0.000
1,10:31,,,DEN 35,0,7,Wil Lutz kicks off 65 yards touchback.,0.000,0.940
1,10:31,1,10,ATL 30,0,7,Bijan Robinson right tackle for 2 yards (tackle by John Franklin-Myers),0.940,0.660
1,9:54,2,8,ATL 32,0,7,Kirk Cousins pass complete short right to Bijan Robinson for 10 yards (tackle by Devon Key and Zach Allen),0.660,1.730
1,9:12,1,10,ATL 42,0,7,Bijan Robinson left tackle for 9 yards (tackle by Ja'Quan McMillian),1.730,2.400
1,8:31,2,1,DEN 49,0,7,Bijan Robinson left guard for no gain (tackle by D.J. Jones),2.400,1.690
1,7:49,3,1,DEN 49,0,7,Bijan Robinson up the middle for 2 yards (tackle by Jonathon Cooper and Cody Barton),1.690,2.460
1,7:07,1,10,DEN 47,0,7,Kirk Cousins pass complete short middle to Ray-Ray McCloud for 9 yards (tackle by P.J. Locke and Nik Bonitto),2.460,3.130
1,6:30,2,1,DEN 38,0,7,Kirk Cousins pass complete short right to Ray-Ray McCloud for 2 yards (tackle by Patrick Surtain),3.130,3.180
1,5:48,1,10,DEN 36,0,7,Kirk Cousins pass complete short left to Ross Dwelley for 5 yards (tackle by Justin Strnad),3.180,3.310
1,5:09,2,5,DEN 31,0,7,Kirk Cousins pass complete short middle to Drake London for 16 yards (tackle by Devon Key and Ja'Quan McMillian),3.310,4.580
1,4:31,1,10,DEN 15,0,7,Bijan Robinson up the middle for 5 yards (tackle by Riley Moss),4.580,4.840
1,3:58,2,5,DEN 10,0,7,Bijan Robinson left tackle for no gain (tackle by Cody Barton). Penalty on Matthew Bergeron: Offensive Holding 10 yards (accepted) (no play),4.840,3.350
1,3:31,2,15,DEN 20,0,7,Kirk Cousins pass complete short middle to Drake London for no gain (tackle by Devon Key). Penalty on Drake London: Illegal Motion 5 yards (accepted) (no play),3.350,2.670
1,3:06,2,20,DEN 25,0,7,Kirk Cousins pass complete short right to Tyler Allgeier for -1 yards (tackle by Justin Strnad and Ja'Quan McMillian),2.670,1.880
1,2:26,3,21,DEN 26,0,7,Kirk Cousins pass complete short middle to Bijan Robinson for 4 yards (tackle by Nik Bonitto),1.880,1.990
1,1:37,4,17,DEN 22,3,7,Younghoe Koo 41 yard field goal good,1.990,3.000
1,1:33,,,ATL 35,3,7,Bradley Pinion kicks off 65 yards touchback.,0.000,0.940
1,1:33,1,10,DEN 30,3,7,Audric Estime up the middle for no gain (tackle by Kaden Elliss and Jessie Bates),0.940,0.390
1,1:10,2,10,DEN 30,3,7,Bo Nix pass complete short left to Audric Estime for -2 yards (tackle by Richie Grant). Penalty on Adam Trautman: Offensive Holding 10 yards (declined),0.390,-0.560
1,1:06,3,12,DEN 28,3,7,Bo Nix pass complete short right to Javonte Williams for 2 yards (tackle by Richie Grant and Jessie Bates),-0.560,-1.370
1,0:14,4,10,DEN 30,3,7,Riley Dixon punts 51 yards returned by Avery Williams for 12 yards (tackle by Mitchell Fraboni and JL Skinner). Penalty on DeAngelo Malone: Unnecessary Roughness / Offense 15 yards (accepted),-1.370,0.140
2,15:00,1,10,ATL 16,3,7,Kirk Cousins pass incomplete deep left intended for Darnell Mooney (defended by Riley Moss),-0.140,-0.660
2,14:56,2,10,ATL 16,3,7,Kirk Cousins pass incomplete short right intended for Drake London,-0.660,-1.320
2,14:52,3,10,ATL 16,3,7,Kirk Cousins pass complete short right to Bijan Robinson for 15 yards (tackle by Cody Barton),-1.320,1.000
2,14:16,1,10,ATL 31,3,7,Kirk Cousins aborted snap recovered by Kirk Cousins at ATL-22 and returned for -7 yards (tackle by Nik Bonitto),1.000,-0.490
2,13:43,2,17,ATL 24,3,7,Kirk Cousins sacked by Malcolm Roach for -7 yards,-0.490,-2.440
2,13:13,3,24,ATL 17,3,7,Bijan Robinson up the middle for 7 yards (tackle by Jonathon Cooper),-2.440,-1.770
2,12:37,4,17,ATL 24,3,7,Bradley Pinion punts 59 yards returned by Marvin Mims for 6 yards (tackle by Avery Williams),-1.770,-0.480
2,12:23,1,10,DEN 23,3,7,Jaleel McLaughlin left guard for 3 yards (tackle by Jessie Bates),0.480,0.340
2,11:48,2,7,DEN 26,3,7,Bo Nix pass complete short middle to Javonte Williams for 7 yards (tackle by Kaden Elliss and Nathan Landman),0.340,1.140
2,11:03,1,10,DEN 33,3,7,Bo Nix pass complete short right to Lil'Jordan Humphrey for 2 yards (tackle by Arnold Ebiketie),1.140,0.860
2,10:22,2,8,DEN 35,3,7,Javonte Williams right guard for 3 yards (tackle by Nathan Landman),0.860,0.560
2,9:43,3,5,DEN 38,3,7,Penalty on Quinn Meinerz: False Start 5 yards (accepted) (no play),0.560,-0.100
2,9:22,3,10,DEN 33,3,7,Bo Nix pass complete short left to Marvin Mims for 37 yards (tackle by Jessie Bates),-0.100,3.580
2,8:38,1,10,ATL 30,3,7,Marvin Mims left end for -5 yards (tackle by Zach Harrison),3.580,2.360
2,7:58,2,15,ATL 35,3,7,Bo Nix pass complete short left to Javonte Williams for 15 yards (tackle by Justin Simmons and AJ Terrell),2.360,4.240
2,7:12,1,10,ATL 20,3,7,Bo Nix pass complete short middle to Courtland Sutton for 6 yards (tackle by Kaden Elliss),4.240,4.640
2,6:25,2,4,ATL 14,3,13,Javonte Williams left tackle for 14 yards touchdown,4.640,7.000
2,6:16,,,ATL 15,3,14,Wil Lutz kicks extra point good,0.000,0.000
2,6:16,,,DEN 35,3,14,Wil Lutz kicks off 65 yards touchback.,0.000,0.940
2,6:16,1,10,ATL 30,3,14,Bijan Robinson right end for 1 yard (tackle by D.J. Jones),0.940,0.530
2,5:36,2,9,ATL 31,3,14,Kirk Cousins pass complete short left to Darnell Mooney for 8 yards (tackle by Ja'Quan McMillian),0.530,0.890
2,4:56,3,1,ATL 39,3,14,Bijan Robinson up the middle for no gain (tackle by Dondrea Tillman),0.890,-0.780
2,4:31,4,1,ATL 39,3,14,Kirk Cousins pass complete deep right to Drake London for 26 yards (tackle by Ja'Quan McMillian),-0.780,3.250
2,3:42,1,10,DEN 35,3,14,Bijan Robinson left tackle for 3 yards (tackle by Cody Barton and Nik Bonitto),3.250,3.110
2,3:06,2,7,DEN 32,3,14,Kirk Cousins pass incomplete short right intended for Drake London,3.110,2.410
2,2:57,3,7,DEN 32,3,14,Kirk Cousins pass incomplete short right intended for Kyle Pitts (defended by Ja'Quan McMillian),2.410,1.240
2,2:53,4,7,DEN 32,6,14,Younghoe Koo 51 yard field goal good,1.240,3.000
2,2:48,,,ATL 35,6,14,Bradley Pinion kicks off 65 yards touchback.,0.000,0.940
2,2:48,1,10,DEN 30,6,14,Bo Nix scrambles right guard for 3 yards (tackle by Kaden Elliss),0.940,0.800
2,2:04,2,7,DEN 33,6,14,Bo Nix pass complete deep middle to Devaughn Vele for 33 yards (tackle by Justin Simmons),0.800,3.310
2,1:57,1,10,ATL 34,6,14,Bo Nix pass incomplete short right,3.310,2.770
2,1:51,2,10,ATL 34,6,14,Bo Nix pass complete short right to Courtland Sutton for 8 yards (tackle by Richie Grant),2.770,3.140
2,1:42,,,,,,Timeout #1 by Atlanta Falcons,,
2,1:42,3,2,ATL 26,6,14,Bo Nix pass complete short right to Courtland Sutton for 7 yards (tackle by Jessie Bates and AJ Terrell),3.140,4.310
2,1:34,,,,,,Timeout #1 by Denver Broncos,,
2,1:34,1,10,ATL 19,6,14,Bo Nix pass complete short left to Troy Franklin for 8 yards (tackle by Nathan Landman),4.310,5.140
2,1:24,,,,,,Timeout #2 by Atlanta Falcons,,
2,1:24,2,2,ATL 11,6,14,Javonte Williams up the middle for 4 yards (tackle by Richie Grant and Lorenzo Carter),5.140,5.600
2,0:47,1,7,ATL 7,6,14,Bo Nix sacked by Matt Judon for -12 yards,5.600,3.070
2,0:41,,,,,,Timeout #3 by Atlanta Falcons,,
2,0:41,2,19,ATL 19,6,14,Bo Nix pass complete short middle to Courtland Sutton for 7 yards (tackle by Kaden Elliss),3.070,3.100
2,0:30,,,,,,Timeout #2 by Denver Broncos,,
2,0:30,3,12,ATL 12,6,20,Bo Nix pass complete short right to Marvin Mims for 12 yards touchdown,3.100,7.000
2,0:25,,,ATL 15,6,21,Wil Lutz kicks extra point good,0.000,0.000
2,0:25,,,DEN 35,6,21,Wil Lutz kicks off 65 yards touchback.,0.000,0.940
2,0:25,1,10,ATL 30,6,21,Kirk Cousins pass complete deep left to Darnell Mooney for 19 yards (tackle by Riley Moss),0.940,2.190
2,0:11,1,10,ATL 49,6,21,Kirk Cousins spiked the ball,2.190,1.650
2,0:10,,,,,,Timeout #3 by Denver Broncos,,
2,0:10,2,10,ATL 49,6,21,Kirk Cousins pass complete deep right to Drake London for 19 yards (tackle by Riley Moss),1.650,3.450
3,15:00,,,DEN 35,6,21,Wil Lutz kicks off 65 yards touchback.,0.000,0.940
3,15:00,1,10,ATL 30,6,21,Bijan Robinson up the middle for no gain (tackle by John Franklin-Myers and D.J. Jones),0.940,0.390
3,14:42,2,10,ATL 30,6,21,Kirk Cousins pass incomplete short left intended for Darnell Mooney (defended by Riley Moss),0.390,-0.300
3,14:35,3,10,ATL 30,6,21,Kirk Cousins pass complete short right to Ray-Ray McCloud for 3 yards (tackle by Ja'Quan McMillian),-0.300,-1.180
3,13:51,4,7,ATL 33,6,21,Bradley Pinion punts 49 yards returned by Marvin Mims for 37 yards (tackle by Kaden Elliss),-1.180,-2.590
3,13:38,1,10,ATL 45,6,21,Marvin Mims right end for 3 yards (tackle by Matt Judon),2.590,2.450
3,13:09,2,7,ATL 42,6,21,Javonte Williams right guard for 4 yards (tackle by Justin Simmons),2.450,2.280
3,12:23,3,3,ATL 38,6,21,Bo Nix pass incomplete short middle intended for Adam Trautman (defended by Jessie Bates),2.280,0.720
3,12:12,,,,,,Timeout #1 by Denver Broncos,,
3,12:12,4,3,ATL 38,6,21,Bo Nix pass incomplete short middle intended for Lil'Jordan Humphrey (defended by Jessie Bates) Replay Assistant challenged the fumble ruling and the original play was overturned. Bo Nix pass complete short middle to Lil'Jordan Humphrey for 8 yards. Lil'Jordan Humphrey fumbles (tackle by Natrone Brooks recovered by Lil'Jordan Humphrey at ATL-30,0.720,3.580
3,12:06,1,10,ATL 30,6,21,Javonte Williams right guard for 12 yards (tackle by Kaden Elliss),3.580,4.370
3,11:37,1,10,ATL 18,6,21,Bo Nix right end for 2 yards (tackle by Jessie Bates and Nathan Landman),4.370,4.090
3,10:41,2,8,ATL 16,6,21,Bo Nix pass incomplete deep right intended for Courtland Sutton,4.090,3.300
3,10:33,3,8,ATL 16,6,21,Bo Nix pass complete short left to Devaughn Vele for 11 yards (tackle by Justin Simmons),3.300,6.060
3,9:54,1,5,ATL 5,6,21,Bo Nix pass complete short right to Michael Burton for -2 yards (tackle by Kaden Elliss),6.060,4.760
3,9:09,2,7,ATL 7,6,27,Bo Nix pass complete short right to Troy Franklin for 7 yards touchdown,4.760,7.000
3,9:05,,,ATL 15,6,28,Wil Lutz kicks extra point good,0.000,0.000
3,9:05,,,DEN 35,6,28,Wil Lutz kicks off 65 yards touchback.,0.000,0.940
3,9:05,1,10,ATL 30,6,28,Kirk Cousins pass complete short right to Kyle Pitts for 9 yards (tackle by Devon Key),0.940,1.610
3,8:43,2,1,ATL 39,6,28,Kirk Cousins pass incomplete deep right intended for Kyle Pitts,1.610,0.890
3,8:36,3,1,ATL 39,6,28,Kirk Cousins pass complete short left to KhaDarel Hodge for 18 yards (tackle by Ja'Quan McMillian and Nik Bonitto),0.890,2.720
3,8:05,1,10,DEN 43,6,28,Kirk Cousins pass short left intended for Drake London is intercepted by Cody Barton at DEN-31 and returned for 15 yards (tackle by Drake London),2.720,-1.990
3,7:56,1,10,DEN 46,6,28,Bo Nix pass incomplete short left intended for Devaughn Vele (defended by Natrone Brooks),1.990,1.450
3,7:54,2,10,DEN 46,6,28,Bo Nix pass complete short right to Audric Estime for 9 yards (tackle by Jessie Bates) DEN challenged the first down ruling and the original play was overturned. Bo Nix pass complete short right to Audric Estime for 11 yards (tackle by Jessie Bates),1.450,2.720
3,7:40,1,10,ATL 43,6,28,Bo Nix pass complete short left to Audric Estime for no gain (tackle by Nathan Landman). Penalty on Garett Bolles: Unnecessary Roughness / Offense 15 yards (accepted) (no play),2.720,1.730
3,7:09,1,25,DEN 42,6,28,Audric Estime left guard for 4 yards (tackle by David Onyemata and Grady Jarrett),1.730,0.690
3,6:46,2,21,DEN 46,6,28,Bo Nix pass complete short middle to Courtland Sutton for 11 yards (tackle by Jessie Bates),0.690,1.490
3,6:21,3,10,ATL 43,6,28,Bo Nix pass complete short left to Audric Estime for no gain (tackle by Nathan Landman),1.490,0.400
3,5:44,4,10,ATL 43,6,28,Riley Dixon punts 37 yards downed by Tremon Smith,0.400,0.380
3,5:35,1,10,ATL 6,6,28,Bijan Robinson left guard for 5 yards (tackle by Devon Key and Malcolm Roach),-0.380,-0.420
3,5:09,2,5,ATL 11,6,28,Kirk Cousins pass incomplete short middle intended for Drake London (defended by Patrick Surtain),-0.420,-0.840
3,5:03,3,5,ATL 11,6,28,Kirk Cousins pass complete short left to Kyle Pitts for no gain (tackle by Patrick Surtain). Penalty on Patrick Surtain: Face Mask (15 Yards) 15 yards (accepted) (no play),-0.840,0.670
3,4:51,1,10,ATL 26,6,28,Bijan Robinson left end for 1 yard (tackle by Dondrea Tillman and Zach Allen),0.670,0.270
3,4:11,2,9,ATL 27,6,28,Penalty on Kaleb McGary: False Start 5 yards (accepted) (no play),0.270,-0.410
3,3:55,2,14,ATL 22,6,28,Kirk Cousins pass complete short right to Ray-Ray McCloud for 7 yards (tackle by Cody Barton),-0.410,-0.160
3,3:25,3,7,ATL 29,6,28,Kirk Cousins sacked by Jonah Elliss for -7 yards,-0.160,-1.900
3,2:51,4,14,ATL 22,6,28,Bradley Pinion punts 46 yards out of bounds,-1.900,-1.070
3,2:45,1,10,DEN 32,6,28,Jaleel McLaughlin left tackle for 4 yards (tackle by David Onyemata),1.070,1.070
3,2:13,2,6,DEN 36,6,28,Bo Nix pass complete deep right to Courtland Sutton for 23 yards (tackle by AJ Terrell),1.070,2.850
3,1:25,1,10,ATL 41,6,28,Audric Estime left guard for 5 yards (tackle by Kaden Elliss and David Onyemata),2.850,2.980
3,0:53,2,5,ATL 36,6,28,Marvin Mims right end for 6 yards (tackle by Clark Phillips),2.980,3.580
4,15:00,1,10,ATL 30,6,28,Bo Nix pass complete short left to Javonte Williams for 4 yards (tackle by Nathan Landman),3.580,3.570
4,14:18,2,6,ATL 26,6,28,Audric Estime up the middle for -2 yards (tackle by Justin Simmons and Zach Harrison),3.570,2.610
4,14:00,3,8,ATL 28,6,28,Bo Nix pass complete short right to Lil'Jordan Humphrey for 1 yard (tackle by Matt Judon),2.610,1.670
4,13:12,4,7,ATL 27,6,31,Wil Lutz 45 yard field goal good,1.670,3.000
4,13:08,,,DEN 35,6,31,Wil Lutz kicks off 65 yards touchback.,0.000,0.940
4,13:08,1,10,ATL 30,6,31,Penalty on Jake Matthews: False Start 5 yards (accepted) (no play),0.940,0.610
4,13:08,1,15,ATL 25,6,31,Kirk Cousins pass complete short right to Ray-Ray McCloud for 5 yards (tackle by Ja'Quan McMillian),0.610,0.390
4,12:39,2,10,ATL 30,6,31,Kirk Cousins pass complete short left to Bijan Robinson for -1 yards (tackle by Zach Allen),0.390,-0.430
4,12:04,3,11,ATL 29,6,31,Kirk Cousins sacked by Nik Bonitto for -7 yards,-0.430,-1.900
4,11:27,4,18,ATL 22,6,31,Bradley Pinion punts 51 yards returned by Marvin Mims for 14 yards (tackle by Lorenzo Carter and DeAngelo Malone),-1.900,-1.660
4,11:15,1,10,DEN 41,6,31,Javonte Williams up the middle for 6 yards (tackle by Jessie Bates),1.660,1.930
4,10:41,2,4,DEN 47,6,31,Jaleel McLaughlin left guard for 8 yards (tackle by Lorenzo Carter),1.930,2.590
4,9:59,1,10,ATL 45,6,31,Jaleel McLaughlin right end for 4 yards (tackle by Lorenzo Carter and Clark Phillips),2.590,2.580
4,9:12,2,6,ATL 41,6,37,Bo Nix pass complete short left to Lil'Jordan Humphrey for 41 yards touchdown,2.580,7.000
4,9:03,,,ATL 15,6,38,Wil Lutz kicks extra point good,0.000,0.000
4,9:03,,,DEN 35,6,38,Wil Lutz kicks off 65 yards touchback.,0.000,0.940
4,9:03,,,,,,Timeout #2 by Denver Broncos,,
4,9:03,1,10,ATL 30,6,38,Michael Penix pass complete deep middle to Ray-Ray McCloud for 20 yards (tackle by Riley Moss),0.940,2.260
4,8:42,1,10,DEN 50,6,38,Michael Penix pass incomplete deep left intended for Casey Washington,2.260,1.710
4,8:29,2,10,DEN 50,6,38,Jase McClellan right tackle for 8 yards (tackle by Zach Cunningham and Ja'Quan McMillian),1.710,2.080
4,8:03,3,2,DEN 42,6,38,Jase McClellan right tackle for no gain (tackle by Riley Moss),2.080,0.460
4,7:21,4,2,DEN 42,6,38,Michael Penix pass complete short right to KhaDarel Hodge for 4 yards (tackle by Riley Moss and Zach Cunningham),0.460,3.050
4,6:43,1,10,DEN 38,6,38,Michael Penix sacked by Nik Bonitto for no gain,3.050,2.510
4,5:56,2,10,DEN 38,6,38,Jase McClellan right end for -8 yards (tackle by John Franklin-Myers),2.510,0.760
4,5:19,3,18,DEN 46,6,38,Michael Penix pass incomplete short left. Penalty on Matthew Bergeron: Ineligible Downfield Pass 5 yards (declined),0.760,0.200
4,5:03,4,18,DEN 46,6,38,Bradley Pinion punts 42 yards downed by Liam McCullough,0.200,0.380
4,4:53,1,10,DEN 4,6,38,Audric Estime left guard for 5 yards (tackle by Brandon Dorlus and AJ Terrell),-0.380,-0.420
4,4:21,2,5,DEN 9,6,38,Audric Estime right end for 4 yards (tackle by AJ Terrell),-0.420,-0.370
4,4:06,3,1,DEN 13,6,38,Michael Burton up the middle for no gain (tackle by Khalid Kareem and Brandon Dorlus),-0.370,-2.490
4,3:16,4,1,DEN 13,6,38,Riley Dixon punts 47 yards returned by Avery Williams for 10 yards (tackle by Devon Key),-2.490,-2.260
4,3:03,1,10,DEN 50,6,38,Jase McClellan left tackle for 3 yards (tackle by Zach Cunningham),2.260,2.120
4,2:29,2,7,DEN 47,6,38,Jase McClellan right end for 6 yards (tackle by JL Skinner and Dondrea Tillman),2.120,2.210
4,2:00,3,1,DEN 41,6,38,Jase McClellan left guard for 3 yards (tackle by Levelle Bailey and Keidron Smith),2.210,3.050
4,1:27,1,10,DEN 38,6,38,Jase McClellan up the middle for 4 yards (tackle by Levelle Bailey),3.050,3.050
4,0:45,2,6,DEN 34,6,38,Jase McClellan right guard for -1 yards (tackle by Malcolm Roach and Levi Wallace),3.050,2.210